{
  "schema_version": "1.0", "incident_id": "inc_current_mastercard_001", "executive_summary": "Há BRL 24.190,00 de GMV estimado em risco em pagamentos Mastercard processados pela Stripe no Brasil.", "operations_summary": "A approval rate caiu de 84% para 51%; o slice explica 91% das aprovações perdidas e a latência p95 subiu de 820 ms para 4.100 ms.", "what_happened": "Approval rate e latência degradaram simultaneamente.", "where_and_why": "O efeito está concentrado em Stripe × Brasil × Mastercard e é dominado por timeouts do provider.", "recurrence_statement": "É uma recorrência provável do incidente humano confirmado INC-HIST-002D-MASTERCARD, ocorrido dois dias antes; provider, país, bandeira, declines e forma de latência coincidem, mas o escopo de merchants difere.", "evidence_ids": ["evd_current_rate", "evd_current_scope", "evd_prior_confirmed"], "playbook_id": "PB-PROVIDER-DEGRADATION-001", "recommended_action": "Validar a saúde da conexão Stripe no Brasil e preparar rerouting humano para uma conexão alternativa.", "execution": "HUMAN_ONLY", "limitations": ["Similaridade histórica não substitui confirmação humana da causa atual."], "model_version": "gpt-5.6-terra"
}
